{
  "id": "fast-castle-boom",
  "name": {
    "zh": "速升城堡暴经济（23+2）",
    "en": "Fast Castle Boom (23+2)"
  },
  "style": "fast-castle",
  "civs": [],
  "map": "Arabia / 封闭地图",
  "difficulty": "beginner",
  "target": {
    "age": 3,
    "vils": 25,
    "time": "约 10:30 封建、14:00 城堡"
  },
  "summary": "不出兵，23 人口封建、25 人口城堡，随后连建第 2、3 座城镇中心暴经济。",
  "sources": [
    {
      "title": "AOE2 Guide — fast-castle-boom",
      "url": "https://aoe2guide.com/en/builds/fast-castle-boom/",
      "author": "Mehmet Kaan Demir 与 aoe2-guide 贡献者",
      "section": "src/content/build-orders/fast-castle-boom.yaml",
      "ref": "themkdemiiir/aoe2-guide@f09ed56",
      "accessed": "2026-10-11"
    }
  ],
  "license": "步骤中的村民数与分配转写自 aoe2-guide（MIT License，© 2026 Mehmet Kaan Demir，提交 f09ed56），该站据 Hera 攻略指南相应章节整理；中文步骤说明为本项目原创表述，未复制原文。游戏内容 © Microsoft。",
  "review": {
    "status": "reviewed",
    "by": "Steve Jobs",
    "date": "2026-10-11"
  },
  "steps": [
    {
      "vils": 3,
      "actions": [
        {
          "type": "gather",
          "task": "build",
          "count": 3
        },
        {
          "type": "build",
          "building": 70,
          "count": 2
        }
      ],
      "note": "开局 3 个村民：2 人合盖一座房子、1 人盖另一座，盖完都去吃羊；城镇中心立即排村民。",
      "houseText": ["2 人合盖一座房子、1 人盖另一座，盖完都"]
    },
    {
      "vils": 6,
      "actions": [
        {
          "type": "gather",
          "task": "sheep",
          "count": 3,
          "from": "build"
        },
        {
          "type": "gather",
          "task": "sheep",
          "count": 3
        }
      ],
      "note": "盖房的 3 人与前 3 个新村民在城镇中心下吃羊（共 6 人）。",
      "houseText": ["盖房的 "]
    },
    {
      "vils": 9,
      "actions": [
        {
          "type": "gather",
          "task": "wood",
          "count": 3
        },
        {
          "type": "build",
          "building": 562
        }
      ],
      "note": "3 个去伐木，第一个负责建伐木场。"
    },
    {
      "vils": 10,
      "actions": [
        {
          "type": "gather",
          "task": "boar",
          "count": 1
        },
        {
          "type": "lure",
          "target": "boar"
        }
      ],
      "note": "第 10 个引第一头野猪。"
    },
    {
      "vils": 11,
      "actions": [
        {
          "type": "gather",
          "task": "berries",
          "count": 1
        },
        {
          "type": "build",
          "building": 70
        },
        {
          "type": "build",
          "building": 68
        }
      ],
      "note": "第 11 个盖房子，再到浆果旁建磨坊；侦察骑兵推 3 头鹿到城镇中心。",
      "houseText": ["盖房子，再"]
    },
    {
      "vils": 13,
      "actions": [
        {
          "type": "gather",
          "task": "hunt",
          "count": 2
        },
        {
          "type": "lure",
          "target": "boar"
        }
      ],
      "note": "2 个吃肉，其中一人去引第二头野猪。"
    },
    {
      "vils": 17,
      "actions": [
        {
          "type": "gather",
          "task": "berries",
          "count": 4
        },
        {
          "type": "build",
          "building": 70
        }
      ],
      "note": "4 个去浆果；其中一人先盖一座房子（人口上限约 25），避免卡在约 20。",
      "houseText": ["；其中一人先盖一座房子（人口上限约 25），避免卡在约 20"]
    },
    {
      "vils": 17,
      "actions": [
        {
          "type": "gather",
          "task": "farm",
          "count": 4,
          "from": "hunt"
        },
        {
          "type": "build",
          "building": 50,
          "count": 4
        }
      ],
      "note": "野猪吃完时，让吃肉的村民先种 4 块田。"
    },
    {
      "vils": 21,
      "actions": [
        {
          "type": "gather",
          "task": "wood",
          "count": 4
        },
        {
          "type": "build",
          "building": 70
        }
      ],
      "note": "4 个去伐木，仍用同一个伐木场；顺手再盖一座房子（人口上限约 30，够 25 村民 + 侦察）。",
      "houseText": ["；顺手再盖一座房子（人口上限约 30，够 25 村民 + 侦察）"]
    },
    {
      "vils": 23,
      "phase": "feudal-click",
      "actions": [
        {
          "type": "gather",
          "task": "gold",
          "count": 2
        },
        {
          "type": "build",
          "building": 584
        },
        {
          "type": "ageUp",
          "age": 2
        }
      ],
      "note": "2 个去建金矿营地采金，然后点封建。",
      "split": {
        "food": 14,
        "wood": 7,
        "gold": 2,
        "stone": 0
      }
    },
    {
      "vils": 23,
      "phase": "feudal",
      "actions": [
        {
          "type": "build",
          "building": 103
        },
        {
          "type": "build",
          "building": 84
        },
        {
          "type": "research",
          "tech": 202
        },
        {
          "type": "research",
          "tech": 14
        }
      ],
      "note": "到封建：1 人建铁匠铺、2 人建市场（不出兵）；研究双刃斧与马轭。"
    },
    {
      "vils": 25,
      "phase": "castle-click",
      "actions": [
        {
          "type": "gather",
          "task": "wood",
          "count": 2
        },
        {
          "type": "ageUp",
          "age": 3
        }
      ],
      "note": "再 2 个伐木，点城堡。"
    },
    {
      "vils": 25,
      "phase": "castle",
      "actions": [
        {
          "type": "build",
          "building": 109,
          "count": 2
        },
        {
          "type": "research",
          "tech": 203
        }
      ],
      "note": "到城堡：在树林旁建第 2 座城镇中心，再在金/石旁建第 3 座；研究弓锯。有余力就在市场买食物或木材。"
    }
  ]
}
