{
  "id": "fast-castle-knights",
  "name": {
    "zh": "直城后转骑士（暴经济分支）",
    "en": "Fast Castle Knights Branch"
  },
  "style": "fast-castle",
  "civs": ["Franks", "Magyars", "Slavs", "Berbers"],
  "map": "Arabia / 封闭地图",
  "difficulty": "beginner",
  "target": {
    "age": 3,
    "vils": 25,
    "time": "约 10:30 封建、14:00 城堡"
  },
  "summary": "沿用速升城堡暴经济的前半段，到城堡后转采金、建双马厩并训练骑士。分支为本站改编；安全直城后使用，不适合盲目裸奔。",
  "sources": [
    {
      "title": "AOE2 Guide — fast-castle-boom",
      "url": "https://aoe2guide.com/en/builds/fast-castle-boom/",
      "author": "Mehmet Kaan Demir 与 aoe2-guide 贡献者",
      "section": "src/content/build-orders/fast-castle-boom.yaml",
      "ref": "themkdemiiir/aoe2-guide@f09ed56",
      "accessed": "2026-10-11"
    },
    {
      "title": "AoE Buddy — Fast Castle Knights",
      "url": "https://aoebuddy.com/build-orders/25-knight-rush-beginner",
      "author": "Dragonstar（AoE Buddy 整理）",
      "accessed": "2026-10-18"
    }
  ],
  "license": "步骤中的村民数与分配转写自 aoe2-guide（MIT License，© 2026 Mehmet Kaan Demir，提交 f09ed56），该站据 Hera 攻略指南相应章节整理；中文步骤说明为本项目原创表述，未复制原文。游戏内容 © Microsoft。 骑士转型思路参考所列公开攻略，未复制正文；中文为本站原创，来源未授予本项目正文转载许可。",
  "review": {
    "status": "reviewed",
    "by": "Codex（来源与数据核对）",
    "date": "2026-10-18",
    "notes": "核对公开来源、固定 .dat 和模拟回归；不代表人工 ACCEPT 或产品设计签字。"
  },
  "steps": [
    {
      "vils": 3,
      "actions": [
        {
          "type": "gather",
          "task": "build",
          "count": 3
        },
        {
          "type": "build",
          "building": 70,
          "count": 2
        }
      ],
      "note": "开局 3 个村民：2 人合盖一座房子、1 人盖另一座，盖完都去吃羊；城镇中心立即排村民。",
      "houseText": ["2 人合盖一座房子、1 人盖另一座，盖完都"]
    },
    {
      "vils": 6,
      "actions": [
        {
          "type": "gather",
          "task": "sheep",
          "count": 3,
          "from": "build"
        },
        {
          "type": "gather",
          "task": "sheep",
          "count": 3
        }
      ],
      "note": "盖房的 3 人与前 3 个新村民在城镇中心下吃羊（共 6 人）。",
      "houseText": ["盖房的 "]
    },
    {
      "vils": 9,
      "actions": [
        {
          "type": "gather",
          "task": "wood",
          "count": 3
        },
        {
          "type": "build",
          "building": 562
        }
      ],
      "note": "3 个去伐木，第一个负责建伐木场。"
    },
    {
      "vils": 10,
      "actions": [
        {
          "type": "gather",
          "task": "boar",
          "count": 1
        },
        {
          "type": "lure",
          "target": "boar"
        }
      ],
      "note": "第 10 个引第一头野猪。"
    },
    {
      "vils": 11,
      "actions": [
        {
          "type": "gather",
          "task": "berries",
          "count": 1
        },
        {
          "type": "build",
          "building": 70
        },
        {
          "type": "build",
          "building": 68
        }
      ],
      "note": "第 11 个盖房子，再到浆果旁建磨坊；侦察骑兵推 3 头鹿到城镇中心。",
      "houseText": ["盖房子，再"]
    },
    {
      "vils": 13,
      "actions": [
        {
          "type": "gather",
          "task": "hunt",
          "count": 2
        },
        {
          "type": "lure",
          "target": "boar"
        }
      ],
      "note": "2 个吃肉，其中一人去引第二头野猪。"
    },
    {
      "vils": 17,
      "actions": [
        {
          "type": "gather",
          "task": "berries",
          "count": 4
        },
        {
          "type": "build",
          "building": 70
        }
      ],
      "note": "4 个去浆果；其中一人先盖一座房子（人口上限约 25），避免卡在约 20。",
      "houseText": ["；其中一人先盖一座房子（人口上限约 25），避免卡在约 20"]
    },
    {
      "vils": 17,
      "actions": [
        {
          "type": "gather",
          "task": "farm",
          "count": 4,
          "from": "hunt"
        },
        {
          "type": "build",
          "building": 50,
          "count": 4
        }
      ],
      "note": "野猪吃完时，让吃肉的村民先种 4 块田。"
    },
    {
      "vils": 21,
      "actions": [
        {
          "type": "gather",
          "task": "wood",
          "count": 4
        },
        {
          "type": "build",
          "building": 70
        }
      ],
      "note": "4 个去伐木，仍用同一个伐木场；顺手再盖一座房子（人口上限约 30，够 25 村民 + 侦察）。",
      "houseText": ["；顺手再盖一座房子（人口上限约 30，够 25 村民 + 侦察）"]
    },
    {
      "vils": 23,
      "phase": "feudal-click",
      "actions": [
        {
          "type": "gather",
          "task": "gold",
          "count": 2
        },
        {
          "type": "build",
          "building": 584
        },
        {
          "type": "ageUp",
          "age": 2
        }
      ],
      "note": "2 个去建金矿营地采金，然后点封建。",
      "split": {
        "food": 14,
        "wood": 7,
        "gold": 2,
        "stone": 0
      }
    },
    {
      "vils": 23,
      "phase": "feudal",
      "actions": [
        {
          "type": "build",
          "building": 103
        },
        {
          "type": "build",
          "building": 84
        },
        {
          "type": "research",
          "tech": 202
        },
        {
          "type": "research",
          "tech": 14
        }
      ],
      "note": "到封建：1 人建铁匠铺、2 人建市场（不出兵）；研究双刃斧与马轭。"
    },
    {
      "vils": 25,
      "phase": "castle-click",
      "actions": [
        {
          "type": "gather",
          "task": "wood",
          "count": 2
        },
        {
          "type": "ageUp",
          "age": 3
        }
      ],
      "note": "再 2 个伐木，点城堡。"
    },
    {
      "vils": 25,
      "phase": "castle",
      "siteAdded": true,
      "actions": [
        {
          "type": "gather",
          "task": "gold",
          "count": 4,
          "from": "wood"
        },
        {
          "type": "build",
          "building": 12
        },
        {
          "type": "build",
          "building": 101,
          "count": 2
        }
      ],
      "note": "城堡后分支：转 4 人采金，补兵营和两座马厩。训练初期骑士后再评估是否补城镇中心。"
    },
    {
      "vils": 25,
      "siteAdded": true,
      "actions": [
        {
          "type": "train",
          "unit": 38,
          "count": 2
        }
      ],
      "note": "先训练 2 个骑士查看首批出兵时间；这是本站最小转型示例，持续出兵还需继续补食物与采金村民。两座马厩在资源和人口允许时并行训练。"
    }
  ]
}
