{
  "id": "archers-19",
  "name": {
    "zh": "19 人口单靶场弓手速攻",
    "en": "19 Pop 1-Range Archers"
  },
  "style": "archers",
  "civs": ["Britons", "Mayans", "Ethiopians", "Tatars", "Vikings"],
  "map": "Arabia",
  "difficulty": "intermediate",
  "target": {
    "age": 2,
    "vils": 19,
    "time": "约 9:15 到达封建"
  },
  "summary": "19 人口升封建，单靶场配箭头科技出弓手，在对手拿出克制兵种前施压。",
  "sources": [
    {
      "title": "AOE2 Guide — 19pop-archers",
      "url": "https://aoe2guide.com/en/builds/19pop-archers/",
      "author": "Mehmet Kaan Demir 与 aoe2-guide 贡献者",
      "section": "src/content/build-orders/19pop-archers.yaml",
      "ref": "themkdemiiir/aoe2-guide@f09ed56",
      "accessed": "2026-10-11"
    }
  ],
  "license": "步骤中的村民数与分配转写自 aoe2-guide（MIT License，© 2026 Mehmet Kaan Demir，提交 f09ed56），该站据 Hera 攻略指南相应章节整理；中文步骤说明为本项目原创表述，未复制原文。游戏内容 © Microsoft。",
  "review": {
    "status": "reviewed",
    "by": "Steve Jobs",
    "date": "2026-10-11"
  },
  "steps": [
    {
      "vils": 3,
      "actions": [
        {
          "type": "gather",
          "task": "build",
          "count": 3
        },
        {
          "type": "build",
          "building": 70,
          "count": 2
        }
      ],
      "note": "开局 3 个村民：2 人合盖一座房子、1 人盖另一座，盖完都去吃羊；城镇中心立即排村民。",
      "houseText": ["2 人合盖一座房子、1 人盖另一座，盖完都"],
      "siteAdded": true
    },
    {
      "vils": 6,
      "actions": [
        {
          "type": "gather",
          "task": "sheep",
          "count": 3,
          "from": "build"
        },
        {
          "type": "gather",
          "task": "sheep",
          "count": 3
        }
      ],
      "note": "盖房的 3 人与前 3 个新村民在城镇中心下吃羊（共 6 人）。",
      "houseText": ["盖房的 3 人与"],
      "split": {
        "food": 6,
        "wood": 0,
        "gold": 0,
        "stone": 0
      }
    },
    {
      "vils": 9,
      "actions": [
        {
          "type": "gather",
          "task": "wood",
          "count": 3
        },
        {
          "type": "build",
          "building": 562
        }
      ],
      "note": "3 个去伐木并建伐木场。",
      "split": {
        "food": 6,
        "wood": 3,
        "gold": 0,
        "stone": 0
      }
    },
    {
      "vils": 10,
      "actions": [
        {
          "type": "gather",
          "task": "boar",
          "count": 1
        },
        {
          "type": "lure",
          "target": "boar"
        }
      ],
      "note": "第 10 个引第一头野猪。",
      "split": {
        "food": 7,
        "wood": 3,
        "gold": 0,
        "stone": 0
      }
    },
    {
      "vils": 11,
      "actions": [
        {
          "type": "gather",
          "task": "berries",
          "count": 1
        },
        {
          "type": "build",
          "building": 70
        },
        {
          "type": "build",
          "building": 68
        }
      ],
      "note": "第 11 个盖房子后到浆果建磨坊；羊找齐后用侦察骑兵推鹿。",
      "houseText": ["盖房子后"],
      "split": {
        "food": 8,
        "wood": 3,
        "gold": 0,
        "stone": 0
      }
    },
    {
      "vils": 17,
      "actions": [
        {
          "type": "gather",
          "task": "hunt",
          "count": 6
        },
        {
          "type": "lure",
          "target": "boar"
        }
      ],
      "note": "6 个吃肉；期间引第二头野猪。",
      "split": {
        "food": 14,
        "wood": 3,
        "gold": 0,
        "stone": 0
      }
    },
    {
      "vils": 19,
      "phase": "feudal-click",
      "actions": [
        {
          "type": "gather",
          "task": "wood",
          "count": 2
        },
        {
          "type": "research",
          "tech": 22
        },
        {
          "type": "ageUp",
          "age": 2
        }
      ],
      "note": "2 个伐木，研究织布机后点封建（理想 9:15 到达）。",
      "split": {
        "food": 14,
        "wood": 5,
        "gold": 0,
        "stone": 0
      }
    },
    {
      "vils": 19,
      "phase": "feudal",
      "actions": [
        {
          "type": "gather",
          "task": "wood",
          "count": 7,
          "from": "hunt"
        }
      ],
      "note": "到封建：从城镇中心下调 5 人去第二片树林建伐木场、2 人去零散树木。",
      "split": {
        "food": 7,
        "wood": 12,
        "gold": 0,
        "stone": 0
      }
    },
    {
      "vils": 19,
      "actions": [
        {
          "type": "gather",
          "task": "build",
          "count": 1,
          "from": "hunt"
        },
        {
          "type": "build",
          "building": 70
        },
        {
          "type": "build",
          "building": 12
        },
        {
          "type": "gather",
          "task": "gold",
          "count": 2,
          "from": "hunt"
        },
        {
          "type": "build",
          "building": 584
        },
        {
          "type": "research",
          "tech": 202
        }
      ],
      "note": "再调 1 人盖房子和兵营、2 人建金矿营地采金；研究双刃斧，暂不研究马轭。",
      "houseText": ["房子"],
      "split": {
        "food": 4,
        "wood": 12,
        "gold": 2,
        "stone": 0,
        "build": 1
      }
    },
    {
      "vils": 21,
      "actions": [
        {
          "type": "build",
          "building": 87
        },
        {
          "type": "train",
          "unit": 4
        },
        {
          "type": "gather",
          "task": "gold",
          "count": 2
        }
      ],
      "note": "封建到达后再造第 20、21 个村民去采金（共 4 金）；建靶场开始出弓手。",
      "split": {
        "food": 4,
        "wood": 12,
        "gold": 4,
        "stone": 0,
        "build": 1
      }
    },
    {
      "vils": 21,
      "actions": [
        {
          "type": "build",
          "building": 103
        },
        {
          "type": "research",
          "tech": 199
        },
        {
          "type": "gather",
          "task": "berries",
          "count": 3,
          "from": "hunt"
        },
        {
          "type": "gather",
          "task": "berries",
          "count": 1,
          "from": "build"
        },
        {
          "type": "build",
          "building": 50
        },
        {
          "type": "train",
          "unit": 93
        }
      ],
      "note": "建铁匠铺研究箭头；把剩下的肉类村民和建造者调去浆果（共 5 人），开始种田。担心对手侦察骑兵可从兵营补 1–4 个长枪兵。",
      "split": {
        "food": 5,
        "wood": 12,
        "gold": 4,
        "stone": 0,
        "build": 0
      }
    }
  ]
}
